Bureau of Justice Statistics,,,,
Filename: rsavcaf9513f3.csv,,,,
"Figure 3. Type of rape or sexual assault experienced by female victims ages 18 to 24, by  post-secondary enrollment status, 1995–2013",,,,
"Report title: Rape or sexual assault victimization among College-age  females , 1995-2013 NCJ 248471",,,,
"Data Source:  Bureau of Justice Statistics, National Crime Victimization Survey, 1995–2013",,,,
Author: Sofi Sinozich and Lynn Langton,,,,
Refer questions to: askbjs@usdoj.gov   202-307-0765,,,,
,,,,
"Figure 3. Type of rape or sexual assault experienced by female victims ages 18 to 24, by  post-secondary enrollment status, 1995–2013",,,,
,,,,
,Completed rape,Attempted rape,Sexual assault,Threat of rape or sexual assault
Students/a,33,25,31,11
Non-students/b,40,24,28,8
"Note: Excludes a small number of female victims ages 18 to 24 with unknown enrollment status (less than 1%). The average annual population was 5,130,004 for students and 8,614,853 for nonstudents. See appendix table 2 for standard errors. See Methodology for definitions.",,,,
"a/Includes female victims ages 18 to 24 enrolled part time or full time in a post-secondary institution (i.e., college or university, trade school, or vocational school).",,,,
b/Includes female victims ages 18 to 24 not enrolled in a post-secondary institution.,,,,
"Source: Bureau of Justice Statistics, National Crime Victimization Survey, 1995–2013.",,,,
